{
  "$schema": "https://json-schema.org/draft/2020-12/schema", "$id": "espresso.val001.postresult_execution_lock.v1", "type": "object",
  "required": ["schema_version", "record_id", "task", "issue", "pull_request", "branch", "authority_status", "remaining_real_data_comparison_invocations", "remaining_governed_result_producing_invocations", "alternate_invocation_id_allowed", "alternate_ledger_allowed", "alternate_authority_allowed", "alternate_activation_allowed", "further_retry_authorized", "bindings", "claim_boundaries"],
  "properties": {"schema_version": {"const": "espresso.val001.postresult_execution_lock.v1"}, "record_id": {"type": "string", "minLength": 1}, "task": {"const": "VAL-001"}, "issue": {"const": 37}, "pull_request": {"const": 38}, "branch": {"const": "validation/val-001-source-adapters"}, "authority_status": {"const": "CONSUMED"}, "remaining_real_data_comparison_invocations": {"const": 0}, "remaining_governed_result_producing_invocations": {"const": 0}, "alternate_invocation_id_allowed": {"const": false}, "alternate_ledger_allowed": {"const": false}, "alternate_authority_allowed": {"const": false}, "alternate_activation_allowed": {"const": false}, "further_retry_authorized": {"const": false}, "bindings": {"type": "array", "minItems": 4, "items": {"type": "object", "required": ["path", "sha256"], "properties": {"path": {"type": "string", "minLength": 1}, "sha256": {"type": "string", "pattern": "[0-9a-f]{64}"}}, "additionalProperties": false}}, "claim_boundaries": {"type": "object", "required": ["physical_validation", "new_governing_physics"], "properties": {"physical_validation": {"const": "NOT_ESTABLISHED"}, "new_governing_physics": {"const": "NOT_AUTHORIZED_BY_VAL001"}}, "additionalProperties": false}}, "additionalProperties": false
}
